,,,,,,,
https://archive.org/details/MSNBCW_20231029_120000_The_Katie_Phang_Show#start/2413/end/2448,10/29/2023 12:40:28,10/29/2023,MSNBC,The Katie Phang Show,MSNBCW_20231029_120000_The_Katie_Phang_Show,https://archive.org/download/MSNBCW_20231029_120000_The_Katie_Phang_Show/MSNBCW_20231029_120000_The_Katie_Phang_Show.thumbs/MSNBCW_20231029_120000_The_Katie_Phang_Show_002397.jpg,"into labor. since the bombings began, roughly three weeks ago, the palestinian death toll is nearing 8000, that's according to the palestinian health ministry in gaza. now that the war has entered the, quote, second phase, that number is only going to skyrocket in the months ahead."
https://archive.org/details/MSNBCW_20231029_130000_The_Sunday_Show_With_Jonathan_Capehart#start/108/end/143,10/29/2023 13:02:03,10/29/2023,MSNBC,The Sunday Show With Jonathan Capehart,MSNBCW_20231029_130000_The_Sunday_Show_With_Jonathan_Capehart,https://archive.org/download/MSNBCW_20231029_130000_The_Sunday_Show_With_Jonathan_Capehart/MSNBCW_20231029_130000_The_Sunday_Show_With_Jonathan_Capehart.thumbs/MSNBCW_20231029_130000_The_Sunday_Show_With_Jonathan_Capehart_000088.jpg,"verified the content of this video. around the world, hundreds of thousands of protesters continue to take to the streets, calling for a cease-fire. according to the health ministry and gaza, more than 8000 are dead, including more than 3300 children."
https://archive.org/details/MSNBCW_20231029_140000_Velshi#start/1090/end/1125,10/29/2023 14:18:25,10/29/2023,MSNBC,Velshi,MSNBCW_20231029_140000_Velshi,https://archive.org/download/MSNBCW_20231029_140000_Velshi/MSNBCW_20231029_140000_Velshi.thumbs/MSNBCW_20231029_140000_Velshi_001078.jpg,"telecommunications provider. a member of nbc's news crew in gaza also said internet and communications were working again. the health ministry in gaza says more than 8000 people have been killed there, including more than 30000 children."
https://archive.org/details/MSNBCW_20231029_150000_Velshi#start/2702/end/2737,10/29/2023 15:45:17,10/29/2023,MSNBC,Velshi,MSNBCW_20231029_150000_Velshi,https://archive.org/download/MSNBCW_20231029_150000_Velshi/MSNBCW_20231029_150000_Velshi.thumbs/MSNBCW_20231029_150000_Velshi_002697.jpg,more than 8000 people in gaza have been killed so far according to gaza's health ministry. thousands more are a wounded. entire streets of what one stood as buildings have been reduced to rubble. while this seems unfathomable
https://archive.org/details/MSNBCW_20231029_170000_Alex_Witt_Reports#start/215/end/250,10/29/2023 17:03:50,10/29/2023,MSNBC,Alex Witt Reports,MSNBCW_20231029_170000_Alex_Witt_Reports,https://archive.org/download/MSNBCW_20231029_170000_Alex_Witt_Reports/MSNBCW_20231029_170000_Alex_Witt_Reports.thumbs/MSNBCW_20231029_170000_Alex_Witt_Reports_000207.jpg,"warned by the idf to evacuate, but they have no place to go. meanwhile, as the number of casualties increases, gaza says it is running out of cemetery space in which to bury the dead. the ministry of health in gaza now says more than 1000 people have been killed, including"
https://archive.org/details/MSNBCW_20231029_220000_American_Voices_With_Alicia_Menendez#start/156/end/191,10/29/2023 22:02:51,10/29/2023,MSNBC,American Voices With Alicia Menendez,MSNBCW_20231029_220000_American_Voices_With_Alicia_Menendez,https://archive.org/download/MSNBCW_20231029_220000_American_Voices_With_Alicia_Menendez/MSNBCW_20231029_220000_American_Voices_With_Alicia_Menendez.thumbs/MSNBCW_20231029_220000_American_Voices_With_Alicia_Menendez_000148.jpg,"here. we will continue to ask those questions as we go forward. this afternoon, we learned the u.n. security council held an emergency meeting tomorrow to discuss the newest face of the war. gaza's ministry of health said the death toll has now surpassed 8000."
https://archive.org/details/MSNBCW_20231030_010000_Ayman#start/2699/end/2734,10/30/2023 1:45:14,10/30/2023,MSNBC,Ayman,MSNBCW_20231030_010000_Ayman,https://archive.org/download/MSNBCW_20231030_010000_Ayman/MSNBCW_20231030_010000_Ayman.thumbs/MSNBCW_20231030_010000_Ayman_002698.jpg,"he didn't say health officials. the president of the united states saying palestinians, telling the world to doubt the numbers just on one side of the war. in an apparent response to biden's remarks, e gaza health ministry released the"
https://archive.org/details/MSNBCW_20231030_010000_Ayman#start/2715/end/2750,10/30/2023 1:45:30,10/30/2023,MSNBC,Ayman,MSNBCW_20231030_010000_Ayman,https://archive.org/download/MSNBCW_20231030_010000_Ayman/MSNBCW_20231030_010000_Ayman.thumbs/MSNBCW_20231030_010000_Ayman_002698.jpg,names and ages of more than 6000 people it says have been killed since the war began. -- the numbers from the health ministry --  _
https://archive.org/details/MSNBCW_20231030_040000_Ayman#start/2707/end/2742,10/30/2023 4:45:22,10/30/2023,MSNBC,Ayman,MSNBCW_20231030_040000_Ayman,https://archive.org/download/MSNBCW_20231030_040000_Ayman/MSNBCW_20231030_040000_Ayman.thumbs/MSNBCW_20231030_040000_Ayman_002697.jpg,"states saying palestinians, telling the world to doubt the numbers just on onside of the war. in an apparent response to biden's remarks,he gaza health ministry released the names and ages of more than 6000 people it says have been killed since the war began."
https://archive.org/details/MSNBCW_20231030_040000_Ayman#start/2722/end/2757,10/30/2023 4:45:37,10/30/2023,MSNBC,Ayman,MSNBCW_20231030_040000_Ayman,https://archive.org/download/MSNBCW_20231030_040000_Ayman/MSNBCW_20231030_040000_Ayman.thumbs/MSNBCW_20231030_040000_Ayman_002697.jpg,-- the numbers from the health ministry -- still hundreds of people buried -- [inaudible] journalists are risking their lives to tell the truth about what is happening on the
https://archive.org/details/MSNBCW_20231030_100000_Morning_Joe#start/4844/end/4879,10/30/2023 11:20:59,10/30/2023,MSNBC,Morning Joe,MSNBCW_20231030_100000_Morning_Joe,https://archive.org/download/MSNBCW_20231030_100000_Morning_Joe/MSNBCW_20231030_100000_Morning_Joe.thumbs/MSNBCW_20231030_100000_Morning_Joe_004828.jpg,children killed has been equivalent to every conflict in the world since 2019? i'm skeptical about all the numbers coming out of the gaza strip because they're all provided by the hamas-controlled
https://archive.org/details/MSNBCW_20231030_100000_Morning_Joe#start/4860/end/4895,10/30/2023 11:21:15,10/30/2023,MSNBC,Morning Joe,MSNBCW_20231030_100000_Morning_Joe,https://archive.org/download/MSNBCW_20231030_100000_Morning_Joe/MSNBCW_20231030_100000_Morning_Joe.thumbs/MSNBCW_20231030_100000_Morning_Joe_004858.jpg,"ministry of health. i don't deny -- with that caveat, there have been a lot of children killed. i have no doubt. unfortunately, there have been innocent civilians, including children, caught up in the cross-fire between us and hamas. we don't want to see it."
https://archive.org/details/MSNBCW_20231030_160000_Andrea_Mitchell_Reports#start/692/end/727,10/30/2023 16:11:47,10/30/2023,MSNBC,Andrea Mitchell Reports,MSNBCW_20231030_160000_Andrea_Mitchell_Reports,https://archive.org/download/MSNBCW_20231030_160000_Andrea_Mitchell_Reports/MSNBCW_20231030_160000_Andrea_Mitchell_Reports.thumbs/MSNBCW_20231030_160000_Andrea_Mitchell_Reports_000688.jpg,"isis-like organization to use human civilians as human shields. the fuel exists in the gaza strip for all humanitarian needs but it's controlled by hamas. the same hamas we're concerned if we allow more in, it's going"
https://archive.org/details/MSNBCW_20231030_230000_The_ReidOut#start/2290/end/2325,10/30/2023 23:38:25,10/30/2023,MSNBC,The ReidOut,MSNBCW_20231030_230000_The_ReidOut,https://archive.org/download/MSNBCW_20231030_230000_The_ReidOut/MSNBCW_20231030_230000_The_ReidOut.thumbs/MSNBCW_20231030_230000_The_ReidOut_002277.jpg,"children, according to israeli authorities. and as of tonight, the death toll in gaza has topped 8000 since october 7th, including 3400 children. according to the gaza health ministry. president biden may say he doesn't believe palestinians"
https://archive.org/details/MSNBCW_20231031_010000_Alex_Wagner_Tonight#start/219/end/254,10/31/2023 1:03:54,10/31/2023,MSNBC,Alex Wagner Tonight,MSNBCW_20231031_010000_Alex_Wagner_Tonight,https://archive.org/download/MSNBCW_20231031_010000_Alex_Wagner_Tonight/MSNBCW_20231031_010000_Alex_Wagner_Tonight.thumbs/MSNBCW_20231031_010000_Alex_Wagner_Tonight_000207.jpg,"suffering because of a war they didn't start, can't escape, and which is escalated by the day. according to the health ministry run by hamas, more than 8000 palestinians have been killed so far. hospitals have become refugee centers for the newly homeless."
https://archive.org/details/MSNBCW_20231031_020000_The_Last_Word_With_Lawrence_ODonnell#start/1992/end/2027,10/31/2023 2:33:27,10/31/2023,MSNBC,The Last Word With Lawrence ODonnell,MSNBCW_20231031_020000_The_Last_Word_With_Lawrence_ODonnell,https://archive.org/download/MSNBCW_20231031_020000_The_Last_Word_With_Lawrence_ODonnell/MSNBCW_20231031_020000_The_Last_Word_With_Lawrence_ODonnell.thumbs/MSNBCW_20231031_020000_The_Last_Word_With_Lawrence_ODonnell_001978.jpg,tonight. what we know the death toll inside of gaza is rising. the hamas-run causative ministry of health says over 1000 people have died. unicef says more than 2300 children have died inside of gaza. the humanitarian crisis there
https://archive.org/details/MSNBCW_20231031_030000_The_11th_Hour_With_Stephanie_Ruhle#start/241/end/276,10/31/2023 3:04:16,10/31/2023,MSNBC,The 11th Hour With Stephanie Ruhle,MSNBCW_20231031_030000_The_11th_Hour_With_Stephanie_Ruhle,https://archive.org/download/MSNBCW_20231031_030000_The_11th_Hour_With_Stephanie_Ruhle/MSNBCW_20231031_030000_The_11th_Hour_With_Stephanie_Ruhle.thumbs/MSNBCW_20231031_030000_The_11th_Hour_With_Stephanie_Ruhle_000238.jpg,"7th. this is a time for war. in gaza, more than 2 million civilians are suffering because of war they did not start, cannot escape, which is escalating by the day. according to the health"
https://archive.org/details/MSNBCW_20231031_030000_The_11th_Hour_With_Stephanie_Ruhle#start/256/end/291,10/31/2023 3:04:31,10/31/2023,MSNBC,The 11th Hour With Stephanie Ruhle,MSNBCW_20231031_030000_The_11th_Hour_With_Stephanie_Ruhle,https://archive.org/download/MSNBCW_20231031_030000_The_11th_Hour_With_Stephanie_Ruhle/MSNBCW_20231031_030000_The_11th_Hour_With_Stephanie_Ruhle.thumbs/MSNBCW_20231031_030000_The_11th_Hour_With_Stephanie_Ruhle_000238.jpg,"ministry run by hamas, more than 8000 palestinians have been killed so far. let's get right to my colleague, nbc ellison barber, she was at the israel gaza border where it is now just after 6 am. excuse me, five a.m."
https://archive.org/details/MSNBCW_20231031_040000_Alex_Wagner_Tonight#start/170/end/205,10/31/2023 4:03:05,10/31/2023,MSNBC,Alex Wagner Tonight,MSNBCW_20231031_040000_Alex_Wagner_Tonight,https://archive.org/download/MSNBCW_20231031_040000_Alex_Wagner_Tonight/MSNBCW_20231031_040000_Alex_Wagner_Tonight.thumbs/MSNBCW_20231031_040000_Alex_Wagner_Tonight_000147.jpg,"can't escape, and which is escalating by the day. according to the health ministry run by hamas, more than 1000 palestinians have been killed so far. hospitals have become refugee centers for the newly homeless. they destroyed our house on top"
https://archive.org/details/MSNBCW_20231031_050000_The_Last_Word_With_Lawrence_ODonnell#start/1942/end/1977,10/31/2023 5:32:37,10/31/2023,MSNBC,The Last Word With Lawrence ODonnell,MSNBCW_20231031_050000_The_Last_Word_With_Lawrence_ODonnell,https://archive.org/download/MSNBCW_20231031_050000_The_Last_Word_With_Lawrence_ODonnell/MSNBCW_20231031_050000_The_Last_Word_With_Lawrence_ODonnell.thumbs/MSNBCW_20231031_050000_The_Last_Word_With_Lawrence_ODonnell_001918.jpg,tonight. what we know the death toll inside of gaza is rising. the hamas-run causative ministry of health says over 1000 people have died. unicef says more than 2300 children have died inside of
https://archive.org/details/MSNBCW_20231031_060000_The_11th_Hour_With_Stephanie_Ruhle#start/165/end/200,10/31/2023 6:03:00,10/31/2023,MSNBC,The 11th Hour With Stephanie Ruhle,MSNBCW_20231031_060000_The_11th_Hour_With_Stephanie_Ruhle,https://archive.org/download/MSNBCW_20231031_060000_The_11th_Hour_With_Stephanie_Ruhle/MSNBCW_20231031_060000_The_11th_Hour_With_Stephanie_Ruhle.thumbs/MSNBCW_20231031_060000_The_11th_Hour_With_Stephanie_Ruhle_000148.jpg,"cannot escape, which is escalating by the day. according to the health ministry run by hamas, more than 8000 palestinians have been killed so far. let's get right to my colleague, nbc ellison barber, she was at the israel gaza border where it is now just after 6 am."
https://archive.org/details/MSNBCW_20231031_080000_Alex_Wagner_Tonight#start/205/end/240,10/31/2023 8:03:40,10/31/2023,MSNBC,Alex Wagner Tonight,MSNBCW_20231031_080000_Alex_Wagner_Tonight,https://archive.org/download/MSNBCW_20231031_080000_Alex_Wagner_Tonight/MSNBCW_20231031_080000_Alex_Wagner_Tonight.thumbs/MSNBCW_20231031_080000_Alex_Wagner_Tonight_000178.jpg,"suffering because of a war they didn't start, can't escape, and which is escalated by the day. according to the health ministry run by hamas, more than 8000 as palestinians have been killed so far. hospitals have become refugee ve"
https://archive.org/details/MSNBCW_20231031_150000_Jose_Diaz-Balart_Reports#start/494/end/529,10/31/2023 15:08:29,10/31/2023,MSNBC,Jose Diaz-Balart Reports,MSNBCW_20231031_150000_Jose_Diaz-Balart_Reports,https://archive.org/download/MSNBCW_20231031_150000_Jose_Diaz-Balart_Reports/MSNBCW_20231031_150000_Jose_Diaz-Balart_Reports.thumbs/MSNBCW_20231031_150000_Jose_Diaz-Balart_Reports_000478.jpg,"strikes on buildings there, palestinians -- witnesses are talking about 40 homes damaged or destroyed. the health ministry, which is run by hamas, is talking about hundreds of dead and wounded. this could be an attack on the"
https://archive.org/details/MSNBCW_20231031_150000_Jose_Diaz-Balart_Reports#start/733/end/768,10/31/2023 15:12:28,10/31/2023,MSNBC,Jose Diaz-Balart Reports,MSNBCW_20231031_150000_Jose_Diaz-Balart_Reports,https://archive.org/download/MSNBCW_20231031_150000_Jose_Diaz-Balart_Reports/MSNBCW_20231031_150000_Jose_Diaz-Balart_Reports.thumbs/MSNBCW_20231031_150000_Jose_Diaz-Balart_Reports_000719.jpg,"north korean ministry of health either. there's a war going on and civilians will be caught up in this, and it's a tragedy for many. we need to be cautious about listening to the numbers coming ought of gaza and be wary of"
https://archive.org/details/MSNBCW_20231031_170000_Chris_Jansing_Reports#start/210/end/245,10/31/2023 17:03:45,10/31/2023,MSNBC,Chris Jansing Reports,MSNBCW_20231031_170000_Chris_Jansing_Reports,https://archive.org/download/MSNBCW_20231031_170000_Chris_Jansing_Reports/MSNBCW_20231031_170000_Chris_Jansing_Reports.thumbs/MSNBCW_20231031_170000_Chris_Jansing_Reports_000208.jpg,"injured. the ministry of health, which is run by hamas, is putting the death toll much higher and the higher death toll and higher casualty count are being reported on arab news stations across the region. so, a significant event and one that is getting -- being       _"
https://archive.org/details/MSNBCW_20231031_190000_Katy_Tur_Reports#start/205/end/240,10/31/2023 19:03:40,10/31/2023,MSNBC,Katy Tur Reports,MSNBCW_20231031_190000_Katy_Tur_Reports,https://archive.org/download/MSNBCW_20231031_190000_Katy_Tur_Reports/MSNBCW_20231031_190000_Katy_Tur_Reports.thumbs/MSNBCW_20231031_190000_Katy_Tur_Reports_000327.jpg,"underground. however, we are also seeing devastation in the heavily populated civilian areas. a bit earlier, the gaza health ministry said the jabalia refugee camp was hit by a massive blast. the idf however said they killed"
https://archive.org/details/MSNBCW_20231031_200000_Deadline_White_House#start/5190/end/5225,10/31/2023 21:26:45,10/31/2023,MSNBC,Deadline White House,MSNBCW_20231031_200000_Deadline_White_House,https://archive.org/download/MSNBCW_20231031_200000_Deadline_White_House/MSNBCW_20231031_200000_Deadline_White_House.thumbs/MSNBCW_20231031_200000_Deadline_White_House_005189.jpg,"health catastrophe is imminent due to overcrowding, mass displacement and dehydration. devastating images today appear to show what the palestinian health ministry says was a massive blast at a refugee camp."
https://archive.org/details/MSNBCW_20231101_000000_All_In_With_Chris_Hayes#start/156/end/191,11/1/2023 0:02:51,11/1/2023,MSNBC,All In With Chris Hayes,MSNBCW_20231101_000000_All_In_With_Chris_Hayes,https://archive.org/download/MSNBCW_20231101_000000_All_In_With_Chris_Hayes/MSNBCW_20231101_000000_All_In_With_Chris_Hayes.thumbs/MSNBCW_20231101_000000_All_In_With_Chris_Hayes_000148.jpg,"invasion, all of which together have cost thousands upon thousands of civilian lives. the gaza health ministry, which is controlled by hamas, -- statistics have proven broadly accurate in prior conflicts says the death toll in gaza is over 8500 people."
https://archive.org/details/MSNBCW_20231101_010000_Alex_Wagner_Tonight#start/62/end/97,11/1/2023 1:01:17,11/1/2023,MSNBC,Alex Wagner Tonight,MSNBCW_20231101_010000_Alex_Wagner_Tonight,https://archive.org/download/MSNBCW_20231101_010000_Alex_Wagner_Tonight/MSNBCW_20231101_010000_Alex_Wagner_Tonight.thumbs/MSNBCW_20231101_010000_Alex_Wagner_Tonight_000058.jpg,"more than 1 million residents of gaza have been displaced or told to leave their homes. the israeli war on hamas has led to destruction across gaza, not just in the north. right now, the palestinian ministry of health estimates that more than 8500 people have been killed in gaza, including"
https://archive.org/details/MSNBCW_20231101_010000_Alex_Wagner_Tonight#start/78/end/113,11/1/2023 1:01:33,11/1/2023,MSNBC,Alex Wagner Tonight,MSNBCW_20231101_010000_Alex_Wagner_Tonight,https://archive.org/download/MSNBCW_20231101_010000_Alex_Wagner_Tonight/MSNBCW_20231101_010000_Alex_Wagner_Tonight.thumbs/MSNBCW_20231101_010000_Alex_Wagner_Tonight_000058.jpg,"more than 3500 children. the palestinian ministry of health is controlled by hamas, but in the past, it's statistics about death during these sorts of conflicts have been broadly accurate. internationalhi wealth"
https://archive.org/details/MSNBCW_20231101_030000_The_11th_Hour_With_Stephanie_Ruhle#start/2028/end/2063,11/1/2023 3:34:03,11/1/2023,MSNBC,The 11th Hour With Stephanie Ruhle,MSNBCW_20231101_030000_The_11th_Hour_With_Stephanie_Ruhle,https://archive.org/download/MSNBCW_20231101_030000_The_11th_Hour_With_Stephanie_Ruhle/MSNBCW_20231101_030000_The_11th_Hour_With_Stephanie_Ruhle.thumbs/MSNBCW_20231101_030000_The_11th_Hour_With_Stephanie_Ruhle_002007.jpg,"gaza strip reported by the hospital or the so-called cause the health ministry which, is a -- lieutenant >> lieutenant, i take your point about the numbers. i notably did not use the numbers, here. we are out of town. to your point, as someone who"
https://archive.org/details/MSNBCW_20231101_040000_Alex_Wagner_Tonight#start/93/end/128,11/1/2023 4:01:48,11/1/2023,MSNBC,Alex Wagner Tonight,MSNBCW_20231101_040000_Alex_Wagner_Tonight,https://archive.org/download/MSNBCW_20231101_040000_Alex_Wagner_Tonight/MSNBCW_20231101_040000_Alex_Wagner_Tonight.thumbs/MSNBCW_20231101_040000_Alex_Wagner_Tonight_000088.jpg,"gaza have been displaced or told to leave their homes. the israeli war on hamas has led to destruction across gaza, not just in the north. right now, the palestinian ministry of health estimates that more than 8500 people have been killed in gaza, including more than 3500 children. the palestinian ministry of health is controlled by hamas, but in the past, it's statistics about death during these sorts of conflicts have"
https://archive.org/details/MSNBCW_20231101_060000_The_11th_Hour_With_Stephanie_Ruhle#start/2030/end/2065,11/1/2023 6:34:05,11/1/2023,MSNBC,The 11th Hour With Stephanie Ruhle,MSNBCW_20231101_060000_The_11th_Hour_With_Stephanie_Ruhle,https://archive.org/download/MSNBCW_20231101_060000_The_11th_Hour_With_Stephanie_Ruhle/MSNBCW_20231101_060000_The_11th_Hour_With_Stephanie_Ruhle.thumbs/MSNBCW_20231101_060000_The_11th_Hour_With_Stephanie_Ruhle_002008.jpg,"i want to say one more thing. when you take numbers from the gaza strip reported by the indonesian hospital or the so-called cause the health ministry which, is a -- hamas --  _          _"
https://archive.org/details/MSNBCW_20231101_070000_All_In_With_Chris_Hayes#start/158/end/193,11/1/2023 7:02:53,11/1/2023,MSNBC,All In With Chris Hayes,MSNBCW_20231101_070000_All_In_With_Chris_Hayes,https://archive.org/download/MSNBCW_20231101_070000_All_In_With_Chris_Hayes/MSNBCW_20231101_070000_All_In_With_Chris_Hayes.thumbs/MSNBCW_20231101_070000_All_In_With_Chris_Hayes_000147.jpg,"invasion, all of which together have cost thousands upon thousands of civilian lives. the gaza health ministry, which is controlled by hamas, -- statistics have proven broadly accurate in prior conflicts says the death toll in gaza is over 8500 people. here at home, political battles"
https://archive.org/details/MSNBCW_20231101_080000_Alex_Wagner_Tonight#start/82/end/117,11/1/2023 8:01:37,11/1/2023,MSNBC,Alex Wagner Tonight,MSNBCW_20231101_080000_Alex_Wagner_Tonight,https://archive.org/download/MSNBCW_20231101_080000_Alex_Wagner_Tonight/MSNBCW_20231101_080000_Alex_Wagner_Tonight.thumbs/MSNBCW_20231101_080000_Alex_Wagner_Tonight_000057.jpg,to destruction across gaza not just in the north. right now the palestinian ministry of health estimates more than 8500 people have been killed in gaza including 3500 children. the palestinian ministry of
https://archive.org/details/MSNBCW_20231101_080000_Alex_Wagner_Tonight#start/98/end/133,11/1/2023 8:01:53,11/1/2023,MSNBC,Alex Wagner Tonight,MSNBCW_20231101_080000_Alex_Wagner_Tonight,https://archive.org/download/MSNBCW_20231101_080000_Alex_Wagner_Tonight/MSNBCW_20231101_080000_Alex_Wagner_Tonight.thumbs/MSNBCW_20231101_080000_Alex_Wagner_Tonight_000087.jpg,"health is controlled by hamas, but in the past its statistic about death in these sorts of conflicts heeen called accurate. save the children is now warning the number of children killed in"
https://archive.org/details/MSNBCW_20231101_080000_Alex_Wagner_Tonight#start/515/end/550,11/1/2023 8:08:50,11/1/2023,MSNBC,Alex Wagner Tonight,MSNBCW_20231101_080000_Alex_Wagner_Tonight,https://archive.org/download/MSNBCW_20231101_080000_Alex_Wagner_Tonight/MSNBCW_20231101_080000_Alex_Wagner_Tonight.thumbs/MSNBCW_20231101_080000_Alex_Wagner_Tonight_000508.jpg,death makes that calculation change? i mean lots of folks are understandably skeptical of any hamas led agency in the gaza ministry of health but all indications we have so far is there's enormous search s in gaza. thousands of civilians have
https://archive.org/details/MSNBCW_20231101_100000_Morning_Joe#start/828/end/863,11/1/2023 10:14:03,11/1/2023,MSNBC,Morning Joe,MSNBCW_20231101_100000_Morning_Joe,https://archive.org/download/MSNBCW_20231101_100000_Morning_Joe/MSNBCW_20231101_100000_Morning_Joe.thumbs/MSNBCW_20231101_100000_Morning_Joe_000809.jpg,"to protect the palestinians and help them set up a government that's not run by terrorists. and it has been since 2005. right. excuse me, gaza has been run by hamas since 2005. speaking of american leadership"
https://archive.org/details/MSNBCW_20231101_100000_Morning_Joe#start/7995/end/8030,11/1/2023 12:13:30,11/1/2023,MSNBC,Morning Joe,MSNBCW_20231101_100000_Morning_Joe,https://archive.org/download/MSNBCW_20231101_100000_Morning_Joe/MSNBCW_20231101_100000_Morning_Joe.thumbs/MSNBCW_20231101_100000_Morning_Joe_007978.jpg,"run by terrorists. and it has been since 2005. right. gaza -- or, excuse me, the gaza, yeah, it has been run by hamas since 2005. speaking of american leadership on this question, as expected,"
https://archive.org/details/MSNBCW_20231101_100000_Morning_Joe#start/11096/end/11131,11/1/2023 13:05:11,11/1/2023,MSNBC,Morning Joe,MSNBCW_20231101_100000_Morning_Joe,https://archive.org/download/MSNBCW_20231101_100000_Morning_Joe/MSNBCW_20231101_100000_Morning_Joe.thumbs/MSNBCW_20231101_100000_Morning_Joe_011069.jpg,"it would benefit hamas. a nearby hamas-run hospital says dozens were killed and hundreds wounded. nbc news cannot independently verify those numbers. shortly after the attack, most communications in gaza were shut"
https://archive.org/details/MSNBCW_20231101_140000_Ana_Cabrera_Reports#start/161/end/196,11/1/2023 14:02:56,11/1/2023,MSNBC,Ana Cabrera Reports,MSNBCW_20231101_140000_Ana_Cabrera_Reports,https://archive.org/download/MSNBCW_20231101_140000_Ana_Cabrera_Reports/MSNBCW_20231101_140000_Ana_Cabrera_Reports.thumbs/MSNBCW_20231101_140000_Ana_Cabrera_Reports_000148.jpg,the idf claims killed a senior hamas commander. a local hospital controlled by hamas says dozens of others were killed and hundreds wounded. nbc news has not verified those numbers. i want to give you some reaction
https://archive.org/details/MSNBCW_20231101_140000_Ana_Cabrera_Reports#start/741/end/776,11/1/2023 14:12:36,11/1/2023,MSNBC,Ana Cabrera Reports,MSNBCW_20231101_140000_Ana_Cabrera_Reports,https://archive.org/download/MSNBCW_20231101_140000_Ana_Cabrera_Reports/MSNBCW_20231101_140000_Ana_Cabrera_Reports.thumbs/MSNBCW_20231101_140000_Ana_Cabrera_Reports_000719.jpg,"camp? i know we're getting differing reports from the hamas health ministry, the gaza health ministry versus what the idf is saying as well. do you know anything about the number of people that died there, or the strike there, and the type of access they have to"
