,,,,,,,
https://archive.org/details/CNNW_20231209_050000_Anderson_Cooper_360#start/211/end/246,12/9/2023 5:03:46,12/9/2023,CNN,Anderson Cooper 360,CNNW_20231209_050000_Anderson_Cooper_360,https://archive.org/download/CNNW_20231209_050000_Anderson_Cooper_360/CNNW_20231209_050000_Anderson_Cooper_360.thumbs/CNNW_20231209_050000_Anderson_Cooper_360_000208.jpg,"hamas, 450 targets over the past day israel said on friday as the health ministry reported the death toll climbed to around 17500. han unis hospitals are at the"
https://archive.org/details/CNNW_20231209_050000_Anderson_Cooper_360#start/577/end/612,12/9/2023 5:09:52,12/9/2023,CNN,Anderson Cooper 360,CNNW_20231209_050000_Anderson_Cooper_360,https://archive.org/download/CNNW_20231209_050000_Anderson_Cooper_360/CNNW_20231209_050000_Anderson_Cooper_360.thumbs/CNNW_20231209_050000_Anderson_Cooper_360_000568.jpg,he did film the names and he was disrespectful. he apologies for any offense caused but told cnn he does not know for sure that all those names are innocent dead palestinians because the source is the gaza health ministry
https://archive.org/details/CNNW_20231209_050000_Anderson_Cooper_360#start/594/end/629,12/9/2023 5:10:09,12/9/2023,CNN,Anderson Cooper 360,CNNW_20231209_050000_Anderson_Cooper_360,https://archive.org/download/CNNW_20231209_050000_Anderson_Cooper_360/CNNW_20231209_050000_Anderson_Cooper_360.thumbs/CNNW_20231209_050000_Anderson_Cooper_360_000568.jpg,controlled by hamas. and that's a basic problem on these campuses. the two sides barely agree even on any basic facts. trojans for palestine. why did you feel moved to create that? we have a very large jewish
https://archive.org/details/CNNW_20231209_090000_CNN_Newsroom_Live#start/492/end/527,12/9/2023 9:08:27,12/9/2023,CNN,CNN Newsroom Live,CNNW_20231209_090000_CNN_Newsroom_Live,https://archive.org/download/CNNW_20231209_090000_CNN_Newsroom_Live/CNNW_20231209_090000_CNN_Newsroom_Live.thumbs/CNNW_20231209_090000_CNN_Newsroom_Live_000478.jpg,"ministry of health in gaza, which is run by hamas, it says that it has seen at least 71 people killed in a 24-hour period, and more than 160 -- at least 160 people wounded, fierce, house to house fighting"
https://archive.org/details/CNNW_20231209_100000_CNN_Newsroom_Live#start/262/end/297,12/9/2023 10:04:37,12/9/2023,CNN,CNN Newsroom Live,CNNW_20231209_100000_CNN_Newsroom_Live,https://archive.org/download/CNNW_20231209_100000_CNN_Newsroom_Live/CNNW_20231209_100000_CNN_Newsroom_Live.thumbs/CNNW_20231209_100000_CNN_Newsroom_Live_000238.jpg,are mounting across the strip. the hamas-run health ministry in gaza said one hospital in central gaza reported 71 fatalities in the past 24 hours. it claims more than 17000 people have been killed in gaza since the war began.
https://archive.org/details/CNNW_20231209_100000_CNN_Newsroom_Live#start/451/end/486,12/9/2023 10:07:46,12/9/2023,CNN,CNN Newsroom Live,CNNW_20231209_100000_CNN_Newsroom_Live,https://archive.org/download/CNNW_20231209_100000_CNN_Newsroom_Live/CNNW_20231209_100000_CNN_Newsroom_Live.thumbs/CNNW_20231209_100000_CNN_Newsroom_Live_000448.jpg,"in gaza in a 24-hour period, with fierce fighting reported in the south of the enclave, around khan younis, where it's been described as house-to-house fighting. the hamas ministry of health in"
https://archive.org/details/CNNW_20231209_100000_CNN_Newsroom_Live#start/829/end/864,12/9/2023 10:14:04,12/9/2023,CNN,CNN Newsroom Live,CNNW_20231209_100000_CNN_Newsroom_Live,https://archive.org/download/CNNW_20231209_100000_CNN_Newsroom_Live/CNNW_20231209_100000_CNN_Newsroom_Live.thumbs/CNNW_20231209_100000_CNN_Newsroom_Live_000807.jpg,"assistance there. cnn.com/impact. the hamas-run health ministry in gaza says it has identified more than 300000 cases of 15 infectious diseases in shelters across gaza. according to the ministry, most"
https://archive.org/details/CNNW_20231209_110000_CNN_This_Morning_Weekend#start/2328/end/2363,12/9/2023 11:39:03,12/9/2023,CNN,CNN This Morning Weekend,CNNW_20231209_110000_CNN_This_Morning_Weekend,https://archive.org/download/CNNW_20231209_110000_CNN_This_Morning_Weekend/CNNW_20231209_110000_CNN_This_Morning_Weekend.thumbs/CNNW_20231209_110000_CNN_This_Morning_Weekend_002098.jpg,along the gaza strip. the hamas-run health ministry reports at least 171 killed and 160 hospitalized after the israeli air strikes. meanwhile the u.s. is being
https://archive.org/details/CNNW_20231209_110000_CNN_This_Morning_Weekend#start/2512/end/2547,12/9/2023 11:42:07,12/9/2023,CNN,CNN This Morning Weekend,CNNW_20231209_110000_CNN_This_Morning_Weekend,https://archive.org/download/CNNW_20231209_110000_CNN_This_Morning_Weekend/CNNW_20231209_110000_CNN_This_Morning_Weekend.thumbs/CNNW_20231209_110000_CNN_This_Morning_Weekend_002487.jpg,"people killed a i cording to the health ministry in gaza and some 160 wounded over the past 24 hours. back to you guys. ivan watson, thanks so much. still ahead, the u.s. economy notched up another solid month of job growth, it comes as"
https://archive.org/details/CNNW_20231209_120000_CNN_This_Morning_Weekend#start/1326/end/1361,12/9/2023 12:22:21,12/9/2023,CNN,CNN This Morning Weekend,CNNW_20231209_120000_CNN_This_Morning_Weekend,https://archive.org/download/CNNW_20231209_120000_CNN_This_Morning_Weekend/CNNW_20231209_120000_CNN_This_Morning_Weekend.thumbs/CNNW_20231209_120000_CNN_This_Morning_Weekend_001318.jpg,ministry of health. are you concerned or what are your thoughts on the optics that the u.s. seems to grow more and more isolated on the international stage in its support for israel? that's always been a difficult path for the united
https://archive.org/details/CNNW_20231209_160000_The_Amanpour_Hour#start/1600/end/1635,12/9/2023 16:26:55,12/9/2023,CNN,The Amanpour Hour,CNNW_20231209_160000_The_Amanpour_Hour,https://archive.org/download/CNNW_20231209_160000_The_Amanpour_Hour/CNNW_20231209_160000_The_Amanpour_Hour.thumbs/CNNW_20231209_160000_The_Amanpour_Hour_001528.jpg,"i'm here to thank you. welcome back. the death toll in gaza now stands at more than 17000 palestinians, according to their health ministry there. since israel has claimed to have killed more than 5000 hamas"
https://archive.org/details/CNNW_20231210_000000_CNN_Newsroom_With_Jim_Acosta#start/2603/end/2638,12/10/2023 0:43:38,12/10/2023,CNN,CNN Newsroom With Jim Acosta,CNNW_20231210_000000_CNN_Newsroom_With_Jim_Acosta,https://archive.org/download/CNNW_20231210_000000_CNN_Newsroom_With_Jim_Acosta/CNNW_20231210_000000_CNN_Newsroom_With_Jim_Acosta.thumbs/CNNW_20231210_000000_CNN_Newsroom_With_Jim_Acosta_002579.jpg,now officials say that some 85% of the gazan population is now displaced while the hamas-controlled ministry of health says more than 17000 palestinians have been killed in gaza since october 7th.
https://archive.org/details/CNNW_20231210_080000_CNN_Newsroom_Live#start/132/end/167,12/10/2023 8:02:27,12/10/2023,CNN,CNN Newsroom Live,CNNW_20231210_080000_CNN_Newsroom_Live,https://archive.org/download/CNNW_20231210_080000_CNN_Newsroom_Live/CNNW_20231210_080000_CNN_Newsroom_Live.thumbs/CNNW_20231210_080000_CNN_Newsroom_Live_000117.jpg,to pull victims from the wreckage. residents say at least 150 people were thought to be sheltering inside. the hamas-run health ministry in gaza claims more than 17000 people have been killed in gaza and nearly 49000 wounded since the war began two months ago.
https://archive.org/details/CNNW_20231210_090000_CNN_Newsroom_Live#start/364/end/399,12/10/2023 9:06:19,12/10/2023,CNN,CNN Newsroom Live,CNNW_20231210_090000_CNN_Newsroom_Live,https://archive.org/download/CNNW_20231210_090000_CNN_Newsroom_Live/CNNW_20231210_090000_CNN_Newsroom_Live.thumbs/CNNW_20231210_090000_CNN_Newsroom_Live_000358.jpg,residents say at least 150 people were thought to be sheltering inside. the hamas-run health ministry in gaza claims more than 17000 people have been killed there and nearly 49000 wounded since the war began two months ago.
https://archive.org/details/CNNW_20231210_090000_CNN_Newsroom_Live#start/510/end/545,12/10/2023 9:08:45,12/10/2023,CNN,CNN Newsroom Live,CNNW_20231210_090000_CNN_Newsroom_Live,https://archive.org/download/CNNW_20231210_090000_CNN_Newsroom_Live/CNNW_20231210_090000_CNN_Newsroom_Live.thumbs/CNNW_20231210_090000_CNN_Newsroom_Live_000507.jpg,"october 7, the hamas run health ministry saying 17700 people now killed. israel's national security adviser saying that at least 7000 militants have been killed since israel launched its"
https://archive.org/details/CNNW_20231210_090000_CNN_Newsroom_Live#start/525/end/560,12/10/2023 9:09:00,12/10/2023,CNN,CNN Newsroom Live,CNNW_20231210_090000_CNN_Newsroom_Live,https://archive.org/download/CNNW_20231210_090000_CNN_Newsroom_Live/CNNW_20231210_090000_CNN_Newsroom_Live.thumbs/CNNW_20231210_090000_CNN_Newsroom_Live_000507.jpg,"operations. now, we have no way of verifying the figures, no way of verifying the hamas health ministry figures either. but if they were to be accurate, that would reduce greatly the number of civilians that has been killed, but even then"
https://archive.org/details/CNNW_20231210_100000_CNN_Newsroom_Live#start/372/end/407,12/10/2023 10:06:27,12/10/2023,CNN,CNN Newsroom Live,CNNW_20231210_100000_CNN_Newsroom_Live,https://archive.org/download/CNNW_20231210_100000_CNN_Newsroom_Live/CNNW_20231210_100000_CNN_Newsroom_Live.thumbs/CNNW_20231210_100000_CNN_Newsroom_Live_000358.jpg,they might as well kill us collectively and that would be the end of it. all people have died and have been displaced. we are under pressure and we are hungry. the hamas-run health ministry in gaza claims more than 17000
https://archive.org/details/CNNW_20231210_100000_CNN_Newsroom_Live#start/402/end/437,12/10/2023 10:06:57,12/10/2023,CNN,CNN Newsroom Live,CNNW_20231210_100000_CNN_Newsroom_Live,https://archive.org/download/CNNW_20231210_100000_CNN_Newsroom_Live/CNNW_20231210_100000_CNN_Newsroom_Live.thumbs/CNNW_20231210_100000_CNN_Newsroom_Live_000388.jpg,reporter: intense fighting continuing earlier this morning israel saying that it carried out more than 250 strikes on targets over the previous day including on a military communications center run by hamas adjacent to a mosque that
https://archive.org/details/CNNW_20231210_100000_CNN_Newsroom_Live#start/448/end/483,12/10/2023 10:07:43,12/10/2023,CNN,CNN Newsroom Live,CNNW_20231210_100000_CNN_Newsroom_Live,https://archive.org/download/CNNW_20231210_100000_CNN_Newsroom_Live/CNNW_20231210_100000_CNN_Newsroom_Live.thumbs/CNNW_20231210_100000_CNN_Newsroom_Live_000448.jpg,"also a raid on a house in gaza, throwing grenades in there, you see the explosions taking place and afterwards the blurred images of the militants israel says it killed in that particular battle. bianca, 17700 is the hamas-run"
https://archive.org/details/CNNW_20231210_100000_CNN_Newsroom_Live#start/464/end/499,12/10/2023 10:07:59,12/10/2023,CNN,CNN Newsroom Live,CNNW_20231210_100000_CNN_Newsroom_Live,https://archive.org/download/CNNW_20231210_100000_CNN_Newsroom_Live/CNNW_20231210_100000_CNN_Newsroom_Live.thumbs/CNNW_20231210_100000_CNN_Newsroom_Live_000448.jpg,"health ministry's total for the number of people killed, israel saying at least 7000 militants have been killed by israel since it launched its attacks on hamas in the wake of the attack on october 7th but we can't verify"
https://archive.org/details/CNNW_20231210_100000_CNN_Newsroom_Live#start/2023/end/2058,12/10/2023 10:33:58,12/10/2023,CNN,CNN Newsroom Live,CNNW_20231210_100000_CNN_Newsroom_Live,https://archive.org/download/CNNW_20231210_100000_CNN_Newsroom_Live/CNNW_20231210_100000_CNN_Newsroom_Live.thumbs/CNNW_20231210_100000_CNN_Newsroom_Live_002008.jpg,"bombing of gaza, two large explosions occurred at a building in central gaza early saturday setting off a frantic scramble to pull victims from the wreckage. residents say many people had taken shelter there. the hamas-run health ministry in"
https://archive.org/details/CNNW_20231210_100000_CNN_Newsroom_Live#start/2039/end/2074,12/10/2023 10:34:14,12/10/2023,CNN,CNN Newsroom Live,CNNW_20231210_100000_CNN_Newsroom_Live,https://archive.org/download/CNNW_20231210_100000_CNN_Newsroom_Live/CNNW_20231210_100000_CNN_Newsroom_Live.thumbs/CNNW_20231210_100000_CNN_Newsroom_Live_002037.jpg,"gaza claims more than 17000 people have been killed there, nearly 49000 wounded since the war began two months ago. cnn can't independently verify those figures. the hamas run health ministry in gaza says more than a dozen"
https://archive.org/details/CNNW_20231210_100000_CNN_Newsroom_Live#start/2144/end/2179,12/10/2023 10:35:59,12/10/2023,CNN,CNN Newsroom Live,CNNW_20231210_100000_CNN_Newsroom_Live,https://archive.org/download/CNNW_20231210_100000_CNN_Newsroom_Live/CNNW_20231210_100000_CNN_Newsroom_Live.thumbs/CNNW_20231210_100000_CNN_Newsroom_Live_002127.jpg,"them is very challenging because of the breakdown in communication. so, yes, nowhere is safe in gaza. leo, we just mentioned that the hamas-run health ministry in gaza says its identified more than 300000 cases of around 15"
https://archive.org/details/CNNW_20231211_110000_CNN_This_Morning#start/2121/end/2156,12/11/2023 11:35:36,12/11/2023,CNN,CNN This Morning,CNNW_20231211_110000_CNN_This_Morning,https://archive.org/download/CNNW_20231211_110000_CNN_This_Morning/CNNW_20231211_110000_CNN_This_Morning.thumbs/CNNW_20231211_110000_CNN_This_Morning_001917.jpg,"welcome back. gaza this morning, the death toll is nearing 18000 people according to hamas-run ministry of health. displaced people don't have the basic necessities like food and water and medical supplies"
https://archive.org/details/CNNW_20231211_120000_CNN_This_Morning#start/2274/end/2309,12/11/2023 12:38:09,12/11/2023,CNN,CNN This Morning,CNNW_20231211_120000_CNN_This_Morning,https://archive.org/download/CNNW_20231211_120000_CNN_This_Morning/CNNW_20231211_120000_CNN_This_Morning.thumbs/CNNW_20231211_120000_CNN_This_Morning_002038.jpg,"to benjamin netanyahu, next. this morning, palestinian death toll in gaza is now approaching 18000. that's according to hamas-run ministry of health. united nations secretary-general said gaza is at quote a breaking"
https://archive.org/details/CNNW_20231211_210000_The_Lead_With_Jake_Tapper#start/1576/end/1611,12/11/2023 21:26:31,12/11/2023,CNN,The Lead With Jake Tapper,CNNW_20231211_210000_The_Lead_With_Jake_Tapper,https://archive.org/download/CNNW_20231211_210000_The_Lead_With_Jake_Tapper/CNNW_20231211_210000_The_Lead_With_Jake_Tapper.thumbs/CNNW_20231211_210000_The_Lead_With_Jake_Tapper_001557.jpg,piling up. the health ministry says or than 18000 people have been killed since the start of the war. israel disputes that number and
https://archive.org/details/CNNW_20231213_000000_Erin_Burnett_OutFront#start/334/end/369,12/13/2023 0:05:49,12/13/2023,CNN,Erin Burnett OutFront,CNNW_20231213_000000_Erin_Burnett_OutFront,https://archive.org/download/CNNW_20231213_000000_Erin_Burnett_OutFront/CNNW_20231213_000000_Erin_Burnett_OutFront.thumbs/CNNW_20231213_000000_Erin_Burnett_OutFront_000328.jpg,"pushing south. the idf claims to have killed 7000 militants. the hamas-controlled ministry of health says over 18000 people have been killed in gaza. with almost the entire population displaced. tonight, biden's national"
https://archive.org/details/CNNW_20231213_110000_CNN_This_Morning#start/287/end/322,12/13/2023 11:05:02,12/13/2023,CNN,CNN This Morning,CNNW_20231213_110000_CNN_This_Morning,https://archive.org/download/CNNW_20231213_110000_CNN_This_Morning/CNNW_20231213_110000_CNN_This_Morning.thumbs/CNNW_20231213_110000_CNN_This_Morning_000268.jpg,"death toll continues to grow, the health ministry saying some 18400 palestinians have now been killed in gaza. alex, for weeks you and our security team have been reporting the difference between u.s. and israeli officials."
https://archive.org/details/CNNW_20231213_200000_CNN_News_Central#start/1257/end/1292,12/13/2023 20:21:12,12/13/2023,CNN,CNN News Central,CNNW_20231213_200000_CNN_News_Central,https://archive.org/download/CNNW_20231213_200000_CNN_News_Central/CNNW_20231213_200000_CNN_News_Central.thumbs/CNNW_20231213_200000_CNN_News_Central_001258.jpg,israeli officials during his visit to the country this week. this as the united states is pressing israel to conduct a more surgical campaign against hamas. the hamas controlled health ministry says more than 18600 people have been killed since october 7th.
https://archive.org/details/CNNW_20231214_120000_CNN_This_Morning#start/793/end/828,12/14/2023 12:13:28,12/14/2023,CNN,CNN This Morning,CNNW_20231214_120000_CNN_This_Morning,https://archive.org/download/CNNW_20231214_120000_CNN_This_Morning/CNNW_20231214_120000_CNN_This_Morning.thumbs/CNNW_20231214_120000_CNN_This_Morning_000779.jpg,"with the israelis the fact that the u.s. expects them to be more precise and more surgical in their campaign in gaza because according to the hamas run gaza administrative health, 18000 palestinian civilians, palestinians i should say, have"
https://archive.org/details/CNNW_20231214_220000_The_Lead_With_Jake_Tapper#start/683/end/718,12/14/2023 22:11:38,12/14/2023,CNN,The Lead With Jake Tapper,CNNW_20231214_220000_The_Lead_With_Jake_Tapper,https://archive.org/download/CNNW_20231214_220000_The_Lead_With_Jake_Tapper/CNNW_20231214_220000_The_Lead_With_Jake_Tapper.thumbs/CNNW_20231214_220000_The_Lead_With_Jake_Tapper_000658.jpg,"slaughtered, raped and more on october 7th. we should note the idf claims that they believe they've killed roughly 7000 hamas militants. still, even if you don't, you know, believe every number coming out of the hamas-run palestinian ministry of health, there isn't a lot of"
https://archive.org/details/CNNW_20231215_120000_CNN_This_Morning#start/639/end/674,12/15/2023 12:10:54,12/15/2023,CNN,CNN This Morning,CNNW_20231215_120000_CNN_This_Morning,https://archive.org/download/CNNW_20231215_120000_CNN_This_Morning/CNNW_20231215_120000_CNN_This_Morning.thumbs/CNNW_20231215_120000_CNN_This_Morning_000628.jpg,"civilians, over 18000 now is what the hamas-controlled palestinian health ministry is saying in terms of palestinian deaths. my question to you is, why wouldn't israel have used that more precise approach from the jump? is it because they lacked --  _"
https://archive.org/details/CNNW_20231215_190000_CNN_News_Central#start/230/end/265,12/15/2023 19:04:05,12/15/2023,CNN,CNN News Central,CNNW_20231215_190000_CNN_News_Central,https://archive.org/download/CNNW_20231215_190000_CNN_News_Central/CNNW_20231215_190000_CNN_News_Central.thumbs/CNNW_20231215_190000_CNN_News_Central_000207.jpg,"19000 palestinians have been killed in gaza. some of those combatants, many of them non-combatants, including over 7000 children who are believed to be among those who have been killed in gaza according to the palestinian ministry of health. jake sullivan said earlier"
https://archive.org/details/CNNW_20231216_100000_CNN_Newsroom_Live#start/130/end/165,12/16/2023 10:02:25,12/16/2023,CNN,CNN Newsroom Live,CNNW_20231216_100000_CNN_Newsroom_Live,https://archive.org/download/CNNW_20231216_100000_CNN_Newsroom_Live/CNNW_20231216_100000_CNN_Newsroom_Live.thumbs/CNNW_20231216_100000_CNN_Newsroom_Live_000117.jpg,"allow civilians to replenish basic necessities like food and water. in the meantime, the hamas-controlled ministry of health says airstrikes killed at least 14 people. all this coming amid grief and outrage in israel."
https://archive.org/details/CNNW_20231216_110000_CNN_This_Morning_Weekend#start/1196/end/1231,12/16/2023 11:20:11,12/16/2023,CNN,CNN This Morning Weekend,CNNW_20231216_110000_CNN_This_Morning_Weekend,https://archive.org/download/CNNW_20231216_110000_CNN_This_Morning_Weekend/CNNW_20231216_110000_CNN_This_Morning_Weekend.thumbs/CNNW_20231216_110000_CNN_This_Morning_Weekend_000928.jpg,are the complilicated actitions. we'l'll explain.n. in northern gaza the health ministry says at least 14 people are dead after two air strikes on houses. they have been killed and apprehended during raids at
https://archive.org/details/CNNW_20231216_200000_CNN_Newsroom_With_Fredricka_Whitfield#start/2423/end/2458,12/16/2023 20:40:38,12/16/2023,CNN,CNN Newsroom With Fredricka Whitfield,CNNW_20231216_200000_CNN_Newsroom_With_Fredricka_Whitfield,https://archive.org/download/CNNW_20231216_200000_CNN_Newsroom_With_Fredricka_Whitfield/CNNW_20231216_200000_CNN_Newsroom_With_Fredricka_Whitfield.thumbs/CNNW_20231216_200000_CNN_Newsroom_With_Fredricka_Whitfield_002397.jpg,"progress. priscilla alvarez at the white house, thank you. despite the deadlock in washington, fighting on the ground in gaza has not ceased. the hamas controlled ministry of health in gaza says an air strike today killed at least 14"
https://archive.org/details/CNNW_20231217_190000_CNN_Newsroom_With_Fredricka_Whitfield#start/1631/end/1666,12/17/2023 19:27:26,12/17/2023,CNN,CNN Newsroom With Fredricka Whitfield,CNNW_20231217_190000_CNN_Newsroom_With_Fredricka_Whitfield,https://archive.org/download/CNNW_20231217_190000_CNN_Newsroom_With_Fredricka_Whitfield/CNNW_20231217_190000_CNN_Newsroom_With_Fredricka_Whitfield.thumbs/CNNW_20231217_190000_CNN_Newsroom_With_Fredricka_Whitfield_001617.jpg,"many of those civilians, women and children according to the ministry of health. jeremy diamond, thanks so much, in tel aviv. let's talk more about this and bring in retired u.s. army major generally and analyst"
https://archive.org/details/CNNW_20231217_230000_CNN_Newsroom_With_Jim_Acosta#start/2562/end/2597,12/17/2023 23:42:57,12/17/2023,CNN,CNN Newsroom With Jim Acosta,CNNW_20231217_230000_CNN_Newsroom_With_Jim_Acosta,https://archive.org/download/CNNW_20231217_230000_CNN_Newsroom_With_Jim_Acosta/CNNW_20231217_230000_CNN_Newsroom_With_Jim_Acosta.thumbs/CNNW_20231217_230000_CNN_Newsroom_With_Jim_Acosta_002308.jpg,"again. thanks for coming back on tonight. really appreciate it. yes, sir. thank you. appreciate it. all right. we'll be right back. now to the war between israel and hamas. the palestinian ministry of health says more than 18000 people have died in gaza since the war began."
https://archive.org/details/CNNW_20231218_000000_CNN_Newsroom_With_Jim_Acosta#start/1380/end/1415,12/18/2023 0:23:15,12/18/2023,CNN,CNN Newsroom With Jim Acosta,CNNW_20231218_000000_CNN_Newsroom_With_Jim_Acosta,https://archive.org/download/CNNW_20231218_000000_CNN_Newsroom_With_Jim_Acosta/CNNW_20231218_000000_CNN_Newsroom_With_Jim_Acosta.thumbs/CNNW_20231218_000000_CNN_Newsroom_With_Jim_Acosta_001378.jpg,the u.s. secretary of defense will visit israel for the second time since the attacks. the secretary is expected to push israeli officials to define clear goals in the next phase of the war with hamas as the palestinian ministry of health reports more than 18000
https://archive.org/details/CNNW_20231218_010000_CNN_Newsroom_With_Jim_Acosta#start/1354/end/1389,12/18/2023 1:22:49,12/18/2023,CNN,CNN Newsroom With Jim Acosta,CNNW_20231218_010000_CNN_Newsroom_With_Jim_Acosta,https://archive.org/download/CNNW_20231218_010000_CNN_Newsroom_With_Jim_Acosta/CNNW_20231218_010000_CNN_Newsroom_With_Jim_Acosta.thumbs/CNNW_20231218_010000_CNN_Newsroom_With_Jim_Acosta_001347.jpg,"tunnel was big enough for vehicles to move through. that is a different kind of tunnel. no question about it. general, today the idf announced its taking control of parts of the hamas-run health minister,"
https://archive.org/details/CNNW_20231218_060000_CNN_Newsroom_Live#start/183/end/218,12/18/2023 6:03:18,12/18/2023,CNN,CNN Newsroom Live,CNNW_20231218_060000_CNN_Newsroom_Live,https://archive.org/download/CNNW_20231218_060000_CNN_Newsroom_Live/CNNW_20231218_060000_CNN_Newsroom_Live.thumbs/CNNW_20231218_060000_CNN_Newsroom_Live_000178.jpg,"some of the images coming out of gaza continue to be graphic, and that includes our next video, which is difficult to watch. it comes from jabaliya in northern gaza where a senior official in the hamas-controlled health ministry says at least 24"
https://archive.org/details/CNNW_20231218_080000_CNN_Newsroom_Live#start/127/end/162,12/18/2023 8:02:22,12/18/2023,CNN,CNN Newsroom Live,CNNW_20231218_080000_CNN_Newsroom_Live,https://archive.org/download/CNNW_20231218_080000_CNN_Newsroom_Live/CNNW_20231218_080000_CNN_Newsroom_Live.thumbs/CNNW_20231218_080000_CNN_Newsroom_Live_000117.jpg,"meantime, the israel defense forces says it's uncovered the biggest hamas tunnel in gaza. that tunnel, which the idf says was secured a few weeks ago, was made public on sunday. the hamas-controlled palestinian"
https://archive.org/details/CNNW_20231218_080000_CNN_Newsroom_Live#start/144/end/179,12/18/2023 8:02:39,12/18/2023,CNN,CNN Newsroom Live,CNNW_20231218_080000_CNN_Newsroom_Live,https://archive.org/download/CNNW_20231218_080000_CNN_Newsroom_Live/CNNW_20231218_080000_CNN_Newsroom_Live.thumbs/CNNW_20231218_080000_CNN_Newsroom_Live_000117.jpg,health ministry says the death toll in gaza has climbed to nearly 19000. it doesn't distinguish between combatants and civilians but says 70% of those killed are women and children. some of the images coming out of
https://archive.org/details/CNNW_20231218_080000_CNN_Newsroom_Live#start/160/end/195,12/18/2023 8:02:55,12/18/2023,CNN,CNN Newsroom Live,CNNW_20231218_080000_CNN_Newsroom_Live,https://archive.org/download/CNNW_20231218_080000_CNN_Newsroom_Live/CNNW_20231218_080000_CNN_Newsroom_Live.thumbs/CNNW_20231218_080000_CNN_Newsroom_Live_000147.jpg,"gaza are graphic, and that includes our next video which is hard to watch. it comes from jabaliya in northern gaza where a senior official in the health ministry says at least 24 people were killed and dozens more wounded"
