,,,,,,,
https://archive.org/details/CNNW_20231103_000000_Anderson_Cooper_360#start/325/end/360,11/3/2023 0:05:40,11/3/2023,CNN,Anderson Cooper 360,CNNW_20231103_000000_Anderson_Cooper_360,https://archive.org/download/CNNW_20231103_000000_Anderson_Cooper_360/CNNW_20231103_000000_Anderson_Cooper_360.thumbs/CNNW_20231103_000000_Anderson_Cooper_360_000328.jpg,"should move out of the way because it's dangerous. we now know more than 9000 citizens in gaza have died according to the hamas-run palestinian health authority. more than 22000 have been injured. and the activities, the military"
https://archive.org/details/CNNW_20231103_040000_CNN_Newsroom_Live#start/161/end/196,11/3/2023 4:02:56,11/3/2023,CNN,CNN Newsroom Live,CNNW_20231103_040000_CNN_Newsroom_Live,https://archive.org/download/CNNW_20231103_040000_CNN_Newsroom_Live/CNNW_20231103_040000_CNN_Newsroom_Live.thumbs/CNNW_20231103_040000_CNN_Newsroom_Live_000147.jpg,"were killed in israeli airstrikes according to officials with the united nations. the death toll in gaza since these really offensive began 27 days ago has now passed 9000, according to the palestinian health ministry based in the west bank, which is relying on"
https://archive.org/details/CNNW_20231103_040000_CNN_Newsroom_Live#start/177/end/212,11/3/2023 4:03:12,11/3/2023,CNN,CNN Newsroom Live,CNNW_20231103_040000_CNN_Newsroom_Live,https://archive.org/download/CNNW_20231103_040000_CNN_Newsroom_Live/CNNW_20231103_040000_CNN_Newsroom_Live.thumbs/CNNW_20231103_040000_CNN_Newsroom_Live_000177.jpg,"information from hamas controlled gaza. the u.s. president has -- accuracy of those numbers, here is more on israel -- will cost international support and the secretary of state anthony blinken has been sent back to the region to discuss u.s. concerns directly with"
https://archive.org/details/CNNW_20231103_050000_CNN_Newsroom_Live#start/138/end/173,11/3/2023 5:02:33,11/3/2023,CNN,CNN Newsroom Live,CNNW_20231103_050000_CNN_Newsroom_Live,https://archive.org/download/CNNW_20231103_050000_CNN_Newsroom_Live/CNNW_20231103_050000_CNN_Newsroom_Live.thumbs/CNNW_20231103_050000_CNN_Newsroom_Live_000117.jpg,according to united nations officials. and the inconsistency is really offensive began 73 has now passed 9000. that is according to the palestinian health ministry -- hamas controlled gaza.                 _
https://archive.org/details/CNNW_20231103_080000_CNN_Newsroom_Live#start/514/end/549,11/3/2023 8:08:49,11/3/2023,CNN,CNN Newsroom Live,CNNW_20231103_080000_CNN_Newsroom_Live,https://archive.org/download/CNNW_20231103_080000_CNN_Newsroom_Live/CNNW_20231103_080000_CNN_Newsroom_Live.thumbs/CNNW_20231103_080000_CNN_Newsroom_Live_000507.jpg,zone dropping munitions on a gathering of israeli forces in northeast gaza. the fighting has taken a deadly toll since october 7. over 9000 have been killed here according to palestinian health officials in the hamas
https://archive.org/details/CNNW_20231103_160000_Inside_Politics_With_Dana_Bash#start/1553/end/1588,11/3/2023 16:26:08,11/3/2023,CNN,Inside Politics With Dana Bash,CNNW_20231103_160000_Inside_Politics_With_Dana_Bash,https://archive.org/download/CNNW_20231103_160000_Inside_Politics_With_Dana_Bash/CNNW_20231103_160000_Inside_Politics_With_Dana_Bash.thumbs/CNNW_20231103_160000_Inside_Politics_With_Dana_Bash_001527.jpg,"at face value because it is coming from the hamas-run health ministry in gaza and many in the palestinian american community really felt those comments were insensitive. well, hamas is not -- and the people who are giving us those"
https://archive.org/details/CNNW_20231103_180000_CNN_News_Central#start/403/end/438,11/3/2023 18:06:58,11/3/2023,CNN,CNN News Central,CNNW_20231103_180000_CNN_News_Central,https://archive.org/download/CNNW_20231103_180000_CNN_News_Central/CNNW_20231103_180000_CNN_News_Central.thumbs/CNNW_20231103_180000_CNN_News_Central_000388.jpg,"hospital, gaza's largest medical facility. the cause is not yet clear, but the hamas-run health minute city says it was the idf. can you share with us what you know? was this the result of an"
https://archive.org/details/CNNW_20231103_190000_CNN_News_Central#start/182/end/217,11/3/2023 19:03:17,11/3/2023,CNN,CNN News Central,CNNW_20231103_190000_CNN_News_Central,https://archive.org/download/CNNW_20231103_190000_CNN_News_Central/CNNW_20231103_190000_CNN_News_Central.thumbs/CNNW_20231103_190000_CNN_News_Central_000178.jpg,"ambulances to transport weapons and fighters. in fact, what we've been hearing from a spokesman for the palestinian health ministry who's at the alshiffa hospital is that the series of ambulances"
https://archive.org/details/CNNW_20231103_210000_The_Situation_Room_With_Wolf_Blitzer#start/186/end/221,11/3/2023 21:03:21,11/3/2023,CNN,The Situation Room With Wolf Blitzer,CNNW_20231103_210000_The_Situation_Room_With_Wolf_Blitzer,https://archive.org/download/CNNW_20231103_210000_The_Situation_Room_With_Wolf_Blitzer/CNNW_20231103_210000_The_Situation_Room_With_Wolf_Blitzer.thumbs/CNNW_20231103_210000_The_Situation_Room_With_Wolf_Blitzer_000177.jpg,"strike, 50 others were wounded, according to the palestinian ministry of health, which of course is controlled by hamas. israel also says in its claim of responsibility that hamas has been known to use ambulances to transport hamas militants as"
https://archive.org/details/CNNW_20231103_210000_The_Situation_Room_With_Wolf_Blitzer#start/202/end/237,11/3/2023 21:03:37,11/3/2023,CNN,The Situation Room With Wolf Blitzer,CNNW_20231103_210000_The_Situation_Room_With_Wolf_Blitzer,https://archive.org/download/CNNW_20231103_210000_The_Situation_Room_With_Wolf_Blitzer/CNNW_20231103_210000_The_Situation_Room_With_Wolf_Blitzer.thumbs/CNNW_20231103_210000_The_Situation_Room_With_Wolf_Blitzer_000177.jpg,"well as weaponry. but, wolf, there are questions about the legitimacy of this target particularly as a spokesman for the palestinian ministry of health says this ambulance was part of a convoy carrying wounded individuals who were headed to that rafah crossing in order to leave gaza"
https://archive.org/details/CNNW_20231103_230000_Erin_Burnett_OutFront#start/129/end/164,11/3/2023 23:02:24,11/3/2023,CNN,Erin Burnett OutFront,CNNW_20231103_230000_Erin_Burnett_OutFront,https://archive.org/download/CNNW_20231103_230000_Erin_Burnett_OutFront/CNNW_20231103_230000_Erin_Burnett_OutFront.thumbs/CNNW_20231103_230000_Erin_Burnett_OutFront_000117.jpg,"that cnn has geo located, you can see bloody bodies strewn across the ground. a spokesperson for the health ministry says authorities had"
https://archive.org/details/CNNW_20231103_230000_Erin_Burnett_OutFront#start/335/end/370,11/3/2023 23:05:50,11/3/2023,CNN,Erin Burnett OutFront,CNNW_20231103_230000_Erin_Burnett_OutFront,https://archive.org/download/CNNW_20231103_230000_Erin_Burnett_OutFront/CNNW_20231103_230000_Erin_Burnett_OutFront.thumbs/CNNW_20231103_230000_Erin_Burnett_OutFront_000327.jpg,"weaponry. cnn cannot independently verify those claims and israel has not provided any evidence for that. but what we know is the toll of casualties here. according to the hamas run palestinian ministry of health, 15 people were kill ed in the"
https://archive.org/details/CNNW_20231103_230000_Erin_Burnett_OutFront#start/349/end/384,11/3/2023 23:06:04,11/3/2023,CNN,Erin Burnett OutFront,CNNW_20231103_230000_Erin_Burnett_OutFront,https://archive.org/download/CNNW_20231103_230000_Erin_Burnett_OutFront/CNNW_20231103_230000_Erin_Burnett_OutFront.thumbs/CNNW_20231103_230000_Erin_Burnett_OutFront_000327.jpg,strike. 50 wounded. the palestinian ministry of health says that injured people were being carried in these ambulances. it also says it requested the international red cross to accompany the convoy. the red cross confirming it
https://archive.org/details/CNNW_20231103_230000_Erin_Burnett_OutFront#start/568/end/603,11/3/2023 23:09:43,11/3/2023,CNN,Erin Burnett OutFront,CNNW_20231103_230000_Erin_Burnett_OutFront,https://archive.org/download/CNNW_20231103_230000_Erin_Burnett_OutFront/CNNW_20231103_230000_Erin_Burnett_OutFront.thumbs/CNNW_20231103_230000_Erin_Burnett_OutFront_000568.jpg,other commanders from one place to another without the risk of being followed or attacks by the idf. the numbers from the hamas run ministry of health coming out are 15 killed and i think it was 50 wounded. there's no distinction in those
https://archive.org/details/CNNW_20231104_000000_Anderson_Cooper_360#start/271/end/306,11/4/2023 0:04:46,11/4/2023,CNN,Anderson Cooper 360,CNNW_20231104_000000_Anderson_Cooper_360,https://archive.org/download/CNNW_20231104_000000_Anderson_Cooper_360/CNNW_20231104_000000_Anderson_Cooper_360.thumbs/CNNW_20231104_000000_Anderson_Cooper_360_000268.jpg,"unquote, and that a number of hamas operatives were killed in that strike. officials at the hamas-run health ministry say 15 were killed and dozens wounded in the ambulance attack. cnn cannot confirm either of those claims. the health ministry also says the ambulance was part of a"
https://archive.org/details/CNNW_20231104_000000_Anderson_Cooper_360#start/476/end/511,11/4/2023 0:08:11,11/4/2023,CNN,Anderson Cooper 360,CNNW_20231104_000000_Anderson_Cooper_360,https://archive.org/download/CNNW_20231104_000000_Anderson_Cooper_360/CNNW_20231104_000000_Anderson_Cooper_360.thumbs/CNNW_20231104_000000_Anderson_Cooper_360_000448.jpg,"operatives who were hiding inside ambulances, an ambulance, with weapons. they say their strike was successful. the total number now of civilian casualties is over 9000, according to the hamas-led ministry of health in gaza."
https://archive.org/details/CNNW_20231104_020000_CNN_NewsNight_With_Abby_Phillip#start/2041/end/2076,11/4/2023 2:34:16,11/4/2023,CNN,CNN NewsNight With Abby Phillip,CNNW_20231104_020000_CNN_NewsNight_With_Abby_Phillip,https://archive.org/download/CNNW_20231104_020000_CNN_NewsNight_With_Abby_Phillip/CNNW_20231104_020000_CNN_NewsNight_With_Abby_Phillip.thumbs/CNNW_20231104_020000_CNN_NewsNight_With_Abby_Phillip_002038.jpg,"the palestinian health ministry in gaza, it's run by hamas, they have always put out the death figures. in the 9000 range right now, just above. this is more than any other of these conflicts combined. and some 3000 at least of those are children."
https://archive.org/details/CNNW_20231104_040000_CNN_Newsroom_Live#start/200/end/235,11/4/2023 4:03:35,11/4/2023,CNN,CNN Newsroom Live,CNNW_20231104_040000_CNN_Newsroom_Live,https://archive.org/download/CNNW_20231104_040000_CNN_Newsroom_Live/CNNW_20231104_040000_CNN_Newsroom_Live.thumbs/CNNW_20231104_040000_CNN_Newsroom_Live_000178.jpg,we don't know exactly where they were targeting but we can see it through those images the aftermath of that. the health ministry saying that 60 people are injured in this latest strike.
https://archive.org/details/CNNW_20231104_050000_CNN_Newsroom_Live#start/144/end/179,11/4/2023 5:02:39,11/4/2023,CNN,CNN Newsroom Live,CNNW_20231104_050000_CNN_Newsroom_Live,https://archive.org/download/CNNW_20231104_050000_CNN_Newsroom_Live/CNNW_20231104_050000_CNN_Newsroom_Live.thumbs/CNNW_20231104_050000_CNN_Newsroom_Live_000117.jpg,"have seen the images and we showed some of that but we saw bodies strewn across the street. we saw injured, the hamas led health ministry saying 15 people died, 60 people are injured, from what we understand, according to the palestinian society, they say"
https://archive.org/details/CNNW_20231104_060000_CNN_Newsroom_Live#start/296/end/331,11/4/2023 6:05:11,11/4/2023,CNN,CNN Newsroom Live,CNNW_20231104_060000_CNN_Newsroom_Live,https://archive.org/download/CNNW_20231104_060000_CNN_Newsroom_Live/CNNW_20231104_060000_CNN_Newsroom_Live.thumbs/CNNW_20231104_060000_CNN_Newsroom_Live_000298.jpg,"the hamas led ministry of health saying that 15 people were killed around 16 people are injured in the aftermath of this is going to be very much scrutinize. the other question becomes in terms of getting aid into gaza,"
https://archive.org/details/CNNW_20231104_060000_CNN_Newsroom_Live#start/360/end/395,11/4/2023 6:06:15,11/4/2023,CNN,CNN Newsroom Live,CNNW_20231104_060000_CNN_Newsroom_Live,https://archive.org/download/CNNW_20231104_060000_CNN_Newsroom_Live/CNNW_20231104_060000_CNN_Newsroom_Live.thumbs/CNNW_20231104_060000_CNN_Newsroom_Live_000358.jpg,injured and keep the lights on and keep vital equipment going without access to fuel and we are hearing these reports not only coming through from the ministry of health that is led by hamas but also from doctors and international organizations
https://archive.org/details/CNNW_20231104_070000_CNN_Newsroom_Live#start/96/end/131,11/4/2023 7:01:51,11/4/2023,CNN,CNN Newsroom Live,CNNW_20231104_070000_CNN_Newsroom_Live,https://archive.org/download/CNNW_20231104_070000_CNN_Newsroom_Live/CNNW_20231104_070000_CNN_Newsroom_Live.thumbs/CNNW_20231104_070000_CNN_Newsroom_Live_000087.jpg,the explosion left a scene of carnage and chaos with at least 15 people reported killed according to hamas-run health authorities. the ambulance was said to be part of a convoy carrying patients to southern gaza. the idf claims the ambulance was
https://archive.org/details/CNNW_20231104_070000_CNN_Newsroom_Live#start/128/end/163,11/4/2023 7:02:23,11/4/2023,CNN,CNN Newsroom Live,CNNW_20231104_070000_CNN_Newsroom_Live,https://archive.org/download/CNNW_20231104_070000_CNN_Newsroom_Live/CNNW_20231104_070000_CNN_Newsroom_Live.thumbs/CNNW_20231104_070000_CNN_Newsroom_Live_000117.jpg,"let's start with the air strike on the ambulance convoy. what's the latest? reporter: look, let's start with what we understand the death toll to be according to the hamas-led ministry of health. they say 15 people have died, 16 people are injured."
https://archive.org/details/CNNW_20231104_070000_CNN_Newsroom_Live#start/1808/end/1843,11/4/2023 7:30:23,11/4/2023,CNN,CNN Newsroom Live,CNNW_20231104_070000_CNN_Newsroom_Live,https://archive.org/download/CNNW_20231104_070000_CNN_Newsroom_Live/CNNW_20231104_070000_CNN_Newsroom_Live.thumbs/CNNW_20231104_070000_CNN_Newsroom_Live_001797.jpg,strike targeting an ambulance outside gaza's largest hospital. hamas-run health authorities say the blast killed 15 people and wounded 60 others. israel says the ambulance was being used a by hamas terror
https://archive.org/details/CNNW_20231104_080000_CNN_Newsroom_Live#start/103/end/138,11/4/2023 8:01:58,11/4/2023,CNN,CNN Newsroom Live,CNNW_20231104_080000_CNN_Newsroom_Live,https://archive.org/download/CNNW_20231104_080000_CNN_Newsroom_Live/CNNW_20231104_080000_CNN_Newsroom_Live.thumbs/CNNW_20231104_080000_CNN_Newsroom_Live_000088.jpg,"the israeli military admits it struck an ambulance just outside the hospital, an explosion left a scene of carnage and chaos with at least 15 people reported killed according to hamas-run health authorities. the ambulance was said to be part of a convoy carrying"
https://archive.org/details/CNNW_20231104_080000_CNN_Newsroom_Live#start/134/end/169,11/4/2023 8:02:29,11/4/2023,CNN,CNN Newsroom Live,CNNW_20231104_080000_CNN_Newsroom_Live,https://archive.org/download/CNNW_20231104_080000_CNN_Newsroom_Live/CNNW_20231104_080000_CNN_Newsroom_Live.thumbs/CNNW_20231104_080000_CNN_Newsroom_Live_000118.jpg,"the strike on the ambulance convoy, what more do we know? reporter: well, we know that some of the images we've seen of bodies strewn on the ground, the hamas-led ministry of health saying that 15 people died, 60"
https://archive.org/details/CNNW_20231104_080000_CNN_Newsroom_Live#start/1773/end/1808,11/4/2023 8:29:48,11/4/2023,CNN,CNN Newsroom Live,CNNW_20231104_080000_CNN_Newsroom_Live,https://archive.org/download/CNNW_20231104_080000_CNN_Newsroom_Live/CNNW_20231104_080000_CNN_Newsroom_Live.thumbs/CNNW_20231104_080000_CNN_Newsroom_Live_001647.jpg,"states, canada and all around the world, i'm kim brunhuber, this is cnn newsroom. the u.n. secretary general is condemning an israeli air strike targeting an ambulance outside gaza's largest hospital. hamas-run health authorities say the blast killed 15 people and"
https://archive.org/details/CNNW_20231104_090000_CNN_Newsroom_Live#start/1609/end/1644,11/4/2023 9:27:04,11/4/2023,CNN,CNN Newsroom Live,CNNW_20231104_090000_CNN_Newsroom_Live,https://archive.org/download/CNNW_20231104_090000_CNN_Newsroom_Live/CNNW_20231104_090000_CNN_Newsroom_Live.thumbs/CNNW_20231104_090000_CNN_Newsroom_Live_001587.jpg,terror cell. the hamas-run ministry rejects the assertion saying a driver and paramedic were injured. the idf says it struck two terrorist cells that were attempting to fire into israel
https://archive.org/details/CNNW_20231104_110000_CNN_This_Morning_Weekend#start/303/end/338,11/4/2023 11:05:18,11/4/2023,CNN,CNN This Morning Weekend,CNNW_20231104_110000_CNN_This_Morning_Weekend,https://archive.org/download/CNNW_20231104_110000_CNN_This_Morning_Weekend/CNNW_20231104_110000_CNN_This_Morning_Weekend.thumbs/CNNW_20231104_110000_CNN_This_Morning_Weekend_000297.jpg,"target itself. health ministry officials in gaza, which we should note are connected to hamas, they deny there were hamas fighters in this convoy, but for others the question becomes, okay, if there were fighters in this convoy,"
https://archive.org/details/CNNW_20231104_120000_First_of_All_with_Victor_Blackwell#start/146/end/181,11/4/2023 12:02:41,11/4/2023,CNN,First of All with Victor Blackwell,CNNW_20231104_120000_First_of_All_with_Victor_Blackwell,https://archive.org/download/CNNW_20231104_120000_First_of_All_with_Victor_Blackwell/CNNW_20231104_120000_First_of_All_with_Victor_Blackwell.thumbs/CNNW_20231104_120000_First_of_All_with_Victor_Blackwell_000118.jpg,"according to the hamas run health authority. now, it denies idf claims that the ambulance was being used by hamas. they say the ambulance was part of a medical convoy. egyptian sources say more than"
https://archive.org/details/CNNW_20231104_160000_CNN_Newsroom_With_Fredricka_Whitfield#start/547/end/582,11/4/2023 16:09:22,11/4/2023,CNN,CNN Newsroom With Fredricka Whitfield,CNNW_20231104_160000_CNN_Newsroom_With_Fredricka_Whitfield,https://archive.org/download/CNNW_20231104_160000_CNN_Newsroom_With_Fredricka_Whitfield/CNNW_20231104_160000_CNN_Newsroom_With_Fredricka_Whitfield.thumbs/CNNW_20231104_160000_CNN_Newsroom_With_Fredricka_Whitfield_000538.jpg,"biggest hospital, the al schiff fa hospital. 15 people were killed, 50 or so wounded. according to the palestinian health ministry and palestinian officials. very quickly the idf claimed responsibility but claimed it was targeting the hospital"
https://archive.org/details/CNNW_20231104_180000_CNN_Newsroom_With_Fredricka_Whitfield#start/356/end/391,11/4/2023 18:06:11,11/4/2023,CNN,CNN Newsroom With Fredricka Whitfield,CNNW_20231104_180000_CNN_Newsroom_With_Fredricka_Whitfield,https://archive.org/download/CNNW_20231104_180000_CNN_Newsroom_With_Fredricka_Whitfield/CNNW_20231104_180000_CNN_Newsroom_With_Fredricka_Whitfield.thumbs/CNNW_20231104_180000_CNN_Newsroom_With_Fredricka_Whitfield_000357.jpg,ambulance convoy which left dozens of casualties. the hamas run health ministry in gaza said the ambulances were not being used by hamas terrorists. what to do you say?
https://archive.org/details/CNNW_20231104_180000_CNN_Newsroom_With_Fredricka_Whitfield#start/371/end/406,11/4/2023 18:06:26,11/4/2023,CNN,CNN Newsroom With Fredricka Whitfield,CNNW_20231104_180000_CNN_Newsroom_With_Fredricka_Whitfield,https://archive.org/download/CNNW_20231104_180000_CNN_Newsroom_With_Fredricka_Whitfield/CNNW_20231104_180000_CNN_Newsroom_With_Fredricka_Whitfield.thumbs/CNNW_20231104_180000_CNN_Newsroom_With_Fredricka_Whitfield_000357.jpg,"first of all, as you mentioned, it is the hamas run health ministry. it really is hamas more than the health ministry. everything they say we have to take a step back and ask i f we"
https://archive.org/details/CNNW_20231104_180000_CNN_Newsroom_With_Fredricka_Whitfield#start/869/end/904,11/4/2023 18:14:44,11/4/2023,CNN,CNN Newsroom With Fredricka Whitfield,CNNW_20231104_180000_CNN_Newsroom_With_Fredricka_Whitfield,https://archive.org/download/CNNW_20231104_180000_CNN_Newsroom_With_Fredricka_Whitfield/CNNW_20231104_180000_CNN_Newsroom_With_Fredricka_Whitfield.thumbs/CNNW_20231104_180000_CNN_Newsroom_With_Fredricka_Whitfield_000868.jpg,"number of civilian casualties. thousands of children alone, wolf, have died, according to the palestinian ministry of health. stay safe over there. thank you very much. happening right now, a pro-"
https://archive.org/details/CNNW_20231104_190000_CNN_Newsroom_With_Fredricka_Whitfield#start/125/end/160,11/4/2023 19:02:20,11/4/2023,CNN,CNN Newsroom With Fredricka Whitfield,CNNW_20231104_190000_CNN_Newsroom_With_Fredricka_Whitfield,https://archive.org/download/CNNW_20231104_190000_CNN_Newsroom_With_Fredricka_Whitfield/CNNW_20231104_190000_CNN_Newsroom_With_Fredricka_Whitfield.thumbs/CNNW_20231104_190000_CNN_Newsroom_With_Fredricka_Whitfield_000118.jpg,one explosion hit a u.n. run school. that is serving as a shelter for thousands of palestinian refugees. the hamas run ministry of health says the blast killed at least 15 people and injured
https://archive.org/details/CNNW_20231104_190000_CNN_Newsroom_With_Fredricka_Whitfield#start/1837/end/1872,11/4/2023 19:30:52,11/4/2023,CNN,CNN Newsroom With Fredricka Whitfield,CNNW_20231104_190000_CNN_Newsroom_With_Fredricka_Whitfield,https://archive.org/download/CNNW_20231104_190000_CNN_Newsroom_With_Fredricka_Whitfield/CNNW_20231104_190000_CNN_Newsroom_With_Fredricka_Whitfield.thumbs/CNNW_20231104_190000_CNN_Newsroom_With_Fredricka_Whitfield_001828.jpg,"the u.s. and its partners is the same, but they just have different ideas of how to to get to that goal. meanwhile, in palestine, the palestinian ministry of health said that the death toll there"
https://archive.org/details/CNNW_20231105_010000_The_Whole_Story_With_Anderson_Cooper#start/110/end/145,11/5/2023 1:02:05,11/5/2023,CNN,The Whole Story With Anderson Cooper,CNNW_20231105_010000_The_Whole_Story_With_Anderson_Cooper,https://archive.org/download/CNNW_20231105_010000_The_Whole_Story_With_Anderson_Cooper/CNNW_20231105_010000_The_Whole_Story_With_Anderson_Cooper.thumbs/CNNW_20231105_010000_The_Whole_Story_With_Anderson_Cooper_000088.jpg,"are than 200 people held hostage according to israeli officials and many more people are still unaccounted for. in response, israel began a bombing campaign in gaza according to the hamas- controlled health ministry, more than 4000 people dying there so far."
https://archive.org/details/CNNW_20231105_010000_The_Whole_Story_With_Anderson_Cooper#start/2050/end/2085,11/5/2023 1:34:25,11/5/2023,CNN,The Whole Story With Anderson Cooper,CNNW_20231105_010000_The_Whole_Story_With_Anderson_Cooper,https://archive.org/download/CNNW_20231105_010000_The_Whole_Story_With_Anderson_Cooper/CNNW_20231105_010000_The_Whole_Story_With_Anderson_Cooper.thumbs/CNNW_20231105_010000_The_Whole_Story_With_Anderson_Cooper_002038.jpg,is protecting the mobilization of palestinians. s israel once again fires back. 11 days of bloodshed that killed almost 250 palestinians in gaza according to the hamas- run palestinian healalth
https://archive.org/details/CNNW_20231105_040000_CNN_Newsroom_Live#start/548/end/583,11/5/2023 4:09:23,11/5/2023,CNN,CNN Newsroom Live,CNNW_20231105_040000_CNN_Newsroom_Live,https://archive.org/download/CNNW_20231105_040000_CNN_Newsroom_Live/CNNW_20231105_040000_CNN_Newsroom_Live.thumbs/CNNW_20231105_040000_CNN_Newsroom_Live_000538.jpg,"ministry of health saying that 24000 people have been wounded in more than four weeks of fighting. at least 9425 people killed, that's as of saturday in gaza. in the meanwhile defense"
https://archive.org/details/CNNW_20231105_040000_CNN_Newsroom_Live#start/1899/end/1934,11/5/2023 4:31:54,11/5/2023,CNN,CNN Newsroom Live,CNNW_20231105_040000_CNN_Newsroom_Live,https://archive.org/download/CNNW_20231105_040000_CNN_Newsroom_Live/CNNW_20231105_040000_CNN_Newsroom_Live.thumbs/CNNW_20231105_040000_CNN_Newsroom_Live_001888.jpg,"was hit by airstrikes on saturday. the u.n. ran school was serving as a shelter for displaced families. hamas run health industry says at least 15 people were killed, dozens wounded."
https://archive.org/details/CNNW_20231105_050000_CNN_Newsroom_Live#start/260/end/295,11/5/2023 5:04:35,11/5/2023,CNN,CNN Newsroom Live,CNNW_20231105_050000_CNN_Newsroom_Live,https://archive.org/download/CNNW_20231105_050000_CNN_Newsroom_Live/CNNW_20231105_050000_CNN_Newsroom_Live.thumbs/CNNW_20231105_050000_CNN_Newsroom_Live_000238.jpg,"warnings of catastrophic conditions in the hospitals. the palestinian ministry of health out of ramallah, out of the west bank, it says that more than -- at least 150 health care professionals in gaza have been killed since the beginning of"
https://archive.org/details/CNNW_20231105_050000_CNN_Newsroom_Live#start/418/end/453,11/5/2023 5:07:13,11/5/2023,CNN,CNN Newsroom Live,CNNW_20231105_050000_CNN_Newsroom_Live,https://archive.org/download/CNNW_20231105_050000_CNN_Newsroom_Live/CNNW_20231105_050000_CNN_Newsroom_Live.thumbs/CNNW_20231105_050000_CNN_Newsroom_Live_000418.jpg,that no place in gaza is safe for civilians right now. and i will cite the latest statistics coming out of the palestinian ministry of health in ramallah in the west bank. that's not controlled by hamas. saying now the death toll stands
https://archive.org/details/CNNW_20231105_050000_CNN_Newsroom_Live#start/432/end/467,11/5/2023 5:07:27,11/5/2023,CNN,CNN Newsroom Live,CNNW_20231105_050000_CNN_Newsroom_Live,https://archive.org/download/CNNW_20231105_050000_CNN_Newsroom_Live/CNNW_20231105_050000_CNN_Newsroom_Live.thumbs/CNNW_20231105_050000_CNN_Newsroom_Live_000418.jpg,"at more than 9400 people killed in gaza in just over four weeks. that's as of saturday. more than 24000 wounded. and that ministry of health says 73% of those people, of those"
